{
  "$schema": "https://json-schema.org/draft/2020-12/schema",
  "$id": "https://github.com/fbgallet/philoscopia-referential/blob/main/schemas/arguments.schema.json",
  "title": "arguments",
  "description": "An argument for a position (SUPPORTS) or against it (OBJECTS): a chain of reasons bearing on a pole or an axis median. Generated from the source Zod schemas. This captures structure only; cross-file and cross-field rules (reference resolution, graph acyclicity, pole-count-by-type, weights summing to 1, etc.) are enforced by the corpus validator, not expressible in JSON Schema.",
  "type": "object",
  "properties": {
    "id": {
      "type": "string",
      "pattern": "^[a-z0-9][a-z0-9-]*$"
    },
    "kind": {
      "type": "string",
      "enum": [
        "SUPPORTS",
        "OBJECTS"
      ]
    },
    "position": {
      "type": "object",
      "properties": {
        "axisId": {
          "type": "string",
          "pattern": "^[A-Z][A-Z0-9_]*$"
        },
        "poleId": {
          "type": "string",
          "pattern": "^[A-Z][A-Z0-9_]*$"
        },
        "median": {
          "type": "boolean",
          "const": true
        }
      },
      "required": [
        "axisId"
      ],
      "additionalProperties": false
    },
    "name": {
      "type": "object",
      "properties": {
        "fr": {
          "type": "string",
          "minLength": 1
        },
        "en": {
          "type": "string",
          "minLength": 1
        }
      },
      "required": [
        "fr",
        "en"
      ],
      "additionalProperties": false
    },
    "claim": {
      "type": "object",
      "properties": {
        "fr": {
          "type": "string",
          "minLength": 1
        },
        "en": {
          "type": "string",
          "minLength": 1
        }
      },
      "required": [
        "fr",
        "en"
      ],
      "additionalProperties": false
    },
    "summary": {
      "type": "object",
      "properties": {
        "fr": {
          "type": "string",
          "minLength": 1
        },
        "en": {
          "type": "string",
          "minLength": 1
        }
      },
      "required": [
        "fr",
        "en"
      ],
      "additionalProperties": false
    },
    "development": {
      "minItems": 1,
      "type": "array",
      "items": {
        "type": "object",
        "properties": {
          "fr": {
            "type": "string",
            "minLength": 1
          },
          "en": {
            "type": "string",
            "minLength": 1
          }
        },
        "required": [
          "fr",
          "en"
        ],
        "additionalProperties": false
      }
    },
    "conclusion": {
      "type": "object",
      "properties": {
        "fr": {
          "type": "string",
          "minLength": 1
        },
        "en": {
          "type": "string",
          "minLength": 1
        }
      },
      "required": [
        "fr",
        "en"
      ],
      "additionalProperties": false
    },
    "deepenings": {
      "type": "array",
      "items": {
        "type": "object",
        "properties": {
          "id": {
            "type": "string",
            "pattern": "^[a-z0-9][a-z0-9-]*$"
          },
          "label": {
            "type": "object",
            "properties": {
              "fr": {
                "type": "string",
                "minLength": 1
              },
              "en": {
                "type": "string",
                "minLength": 1
              }
            },
            "required": [
              "fr",
              "en"
            ],
            "additionalProperties": false
          },
          "targetStep": {
            "type": "integer",
            "minimum": 0,
            "maximum": 9007199254740991
          },
          "summary": {
            "type": "object",
            "properties": {
              "fr": {
                "type": "string",
                "minLength": 1
              },
              "en": {
                "type": "string",
                "minLength": 1
              }
            },
            "required": [
              "fr",
              "en"
            ],
            "additionalProperties": false
          },
          "development": {
            "minItems": 1,
            "type": "array",
            "items": {
              "type": "object",
              "properties": {
                "fr": {
                  "type": "string",
                  "minLength": 1
                },
                "en": {
                  "type": "string",
                  "minLength": 1
                }
              },
              "required": [
                "fr",
                "en"
              ],
              "additionalProperties": false
            }
          },
          "conclusion": {
            "type": "object",
            "properties": {
              "fr": {
                "type": "string",
                "minLength": 1
              },
              "en": {
                "type": "string",
                "minLength": 1
              }
            },
            "required": [
              "fr",
              "en"
            ],
            "additionalProperties": false
          },
          "source": {
            "type": "object",
            "properties": {
              "author": {
                "type": "object",
                "properties": {
                  "fr": {
                    "type": "string",
                    "minLength": 1
                  },
                  "en": {
                    "type": "string",
                    "minLength": 1
                  }
                },
                "required": [
                  "fr",
                  "en"
                ],
                "additionalProperties": false
              },
              "figures": {
                "minItems": 1,
                "type": "array",
                "items": {
                  "type": "object",
                  "properties": {
                    "name": {
                      "type": "object",
                      "properties": {
                        "fr": {
                          "type": "string",
                          "minLength": 1
                        },
                        "en": {
                          "type": "string",
                          "minLength": 1
                        }
                      },
                      "required": [
                        "fr",
                        "en"
                      ],
                      "additionalProperties": false
                    },
                    "kind": {
                      "type": "string",
                      "enum": [
                        "PHILOSOPHER",
                        "MOVEMENT",
                        "TRADITION"
                      ]
                    },
                    "slug": {
                      "type": "string",
                      "pattern": "^[a-z0-9][a-z0-9-]*$"
                    }
                  },
                  "required": [
                    "name",
                    "kind"
                  ],
                  "additionalProperties": false
                }
              },
              "work": {
                "type": "object",
                "properties": {
                  "fr": {
                    "type": "string",
                    "minLength": 1
                  },
                  "en": {
                    "type": "string",
                    "minLength": 1
                  }
                },
                "required": [
                  "fr",
                  "en"
                ],
                "additionalProperties": false
              },
              "workId": {
                "type": "string",
                "pattern": "^[a-z0-9][a-z0-9-]*$"
              },
              "year": {
                "type": "integer",
                "minimum": -9007199254740991,
                "maximum": 9007199254740991
              }
            },
            "required": [
              "author"
            ],
            "additionalProperties": false
          }
        },
        "required": [
          "id",
          "label",
          "development"
        ],
        "additionalProperties": false
      }
    },
    "difficulty": {
      "anyOf": [
        {
          "type": "number",
          "const": 1
        },
        {
          "type": "number",
          "const": 2
        },
        {
          "type": "number",
          "const": 3
        }
      ]
    },
    "source": {
      "type": "object",
      "properties": {
        "author": {
          "type": "object",
          "properties": {
            "fr": {
              "type": "string",
              "minLength": 1
            },
            "en": {
              "type": "string",
              "minLength": 1
            }
          },
          "required": [
            "fr",
            "en"
          ],
          "additionalProperties": false
        },
        "figures": {
          "minItems": 1,
          "type": "array",
          "items": {
            "type": "object",
            "properties": {
              "name": {
                "type": "object",
                "properties": {
                  "fr": {
                    "type": "string",
                    "minLength": 1
                  },
                  "en": {
                    "type": "string",
                    "minLength": 1
                  }
                },
                "required": [
                  "fr",
                  "en"
                ],
                "additionalProperties": false
              },
              "kind": {
                "type": "string",
                "enum": [
                  "PHILOSOPHER",
                  "MOVEMENT",
                  "TRADITION"
                ]
              },
              "slug": {
                "type": "string",
                "pattern": "^[a-z0-9][a-z0-9-]*$"
              }
            },
            "required": [
              "name",
              "kind"
            ],
            "additionalProperties": false
          }
        },
        "work": {
          "type": "object",
          "properties": {
            "fr": {
              "type": "string",
              "minLength": 1
            },
            "en": {
              "type": "string",
              "minLength": 1
            }
          },
          "required": [
            "fr",
            "en"
          ],
          "additionalProperties": false
        },
        "workId": {
          "type": "string",
          "pattern": "^[a-z0-9][a-z0-9-]*$"
        },
        "year": {
          "type": "integer",
          "minimum": -9007199254740991,
          "maximum": 9007199254740991
        }
      },
      "required": [
        "author"
      ],
      "additionalProperties": false
    },
    "problems": {
      "type": "array",
      "items": {
        "type": "string",
        "pattern": "^[a-z0-9][a-z0-9-]*$"
      }
    },
    "targets": {
      "type": "array",
      "items": {
        "type": "string",
        "pattern": "^[a-z0-9][a-z0-9-]*$"
      }
    },
    "relatedThoughtExperiment": {
      "type": "string",
      "pattern": "^[a-z0-9][a-z0-9-]*$"
    },
    "responses": {
      "minItems": 2,
      "type": "array",
      "items": {
        "type": "object",
        "properties": {
          "id": {
            "type": "string",
            "pattern": "^[a-z0-9][a-z0-9-]*$"
          },
          "label": {
            "type": "object",
            "properties": {
              "fr": {
                "type": "string",
                "minLength": 1
              },
              "en": {
                "type": "string",
                "minLength": 1
              }
            },
            "required": [
              "fr",
              "en"
            ],
            "additionalProperties": false
          },
          "hints": {
            "minItems": 1,
            "type": "array",
            "items": {
              "type": "object",
              "properties": {
                "axisId": {
                  "type": "string",
                  "pattern": "^[A-Z][A-Z0-9_]*$"
                },
                "value": {
                  "oneOf": [
                    {
                      "type": "object",
                      "properties": {
                        "kind": {
                          "type": "string",
                          "const": "scalar"
                        },
                        "value": {
                          "type": "number",
                          "minimum": -1,
                          "maximum": 1
                        }
                      },
                      "required": [
                        "kind",
                        "value"
                      ],
                      "additionalProperties": false
                    },
                    {
                      "type": "object",
                      "properties": {
                        "kind": {
                          "type": "string",
                          "const": "weights"
                        },
                        "weights": {
                          "minItems": 2,
                          "type": "array",
                          "items": {
                            "type": "number",
                            "minimum": 0,
                            "maximum": 1
                          }
                        }
                      },
                      "required": [
                        "kind",
                        "weights"
                      ],
                      "additionalProperties": false
                    }
                  ]
                },
                "weight": {
                  "type": "number",
                  "minimum": 0,
                  "maximum": 3
                }
              },
              "required": [
                "axisId",
                "value"
              ],
              "additionalProperties": false
            }
          },
          "discussion": {
            "type": "object",
            "properties": {
              "fr": {
                "type": "string",
                "minLength": 1
              },
              "en": {
                "type": "string",
                "minLength": 1
              }
            },
            "required": [
              "fr",
              "en"
            ],
            "additionalProperties": false
          }
        },
        "required": [
          "id",
          "label",
          "hints"
        ],
        "additionalProperties": false
      }
    },
    "test": {
      "type": "string",
      "pattern": "^[a-z0-9][a-z0-9-]*$"
    },
    "updatedAt": {
      "type": "string"
    }
  },
  "required": [
    "id",
    "kind",
    "position",
    "claim",
    "development",
    "difficulty",
    "updatedAt"
  ],
  "additionalProperties": false
}
