{
  "id": "memory-transmission-illusion",
  "kind": "OBJECTS",
  "position": { "axisId": "TIME_ORIENTATION", "poleId": "MEMORY_TRANSMISSION" },
  "name": { "fr": "Vous ne serez pas là", "en": "You will not be there" },
  "claim": {
    "fr": "Se consoler par ce qu'on transmet, c'est se cacher qu'on ne sera plus là pour en jouir.",
    "en": "To console oneself with what one transmits is to hide from oneself that one will no longer be there to enjoy it."
  },
  "summary": {
    "fr": "L'héritage et la postérité adoucissent la peur de disparaître ; mais c'est à notre propre finitude qu'on échappe en se rêvant survivre dans les autres.",
    "en": "Inheritance and posterity soften the fear of vanishing; but it is our own finitude we evade by dreaming ourselves survived in others."
  },
  "development": [
    {
      "fr": "Accordons que nous recevions tout du passé. Reste à savoir ce que vaut, pour la vie qu'on a à vivre, de se tourner d'abord vers ce qui nous précède et nous suit.",
      "en": "Grant that we receive everything from the past. It remains to ask what it is worth, for the life one has to live, to turn first toward what precedes and follows us."
    },
    {
      "fr": "Car de la transmission, je ne verrai pas le fruit : quand mon legs portera, je ne serai plus là. M'y dévouer, c'est vivre pour un temps dont je suis absent, et confier mon prix à ce qui se passera sans moi.",
      "en": "For of transmission I will not see the fruit: when my legacy bears, I will no longer be there. To devote myself to it is to live for a time from which I am absent, and to entrust my worth to what will happen without me."
    },
    {
      "fr": "On peut y voir une dernière ruse contre la mort : faute de durer, on se rêve survivre dans ses enfants, son œuvre, sa lignée. Mais regarder en face sa propre fin, l'<c id='being-toward-death'>être-pour-la-mort</c>, c'est comprendre que nul ne meurt à ma place, et que ce temps qui m'est compté, c'est à moi de le vivre, non à mes héritiers.",
      "en": "One may see in it a last ruse against death: failing to endure, one dreams of surviving in one's children, one's work, one's line. But to face one's own end, <c id='being-toward-death'>being-toward-death</c>, is to understand that no one dies in my place, and that this time allotted to me is mine to live, not my heirs'."
    }
  ],
  "conclusion": {
    "fr": "Donc se vouer à la transmission peut adoucir la pensée de disparaître, mais au prix d'un détour : on s'occupe de l'après pour n'avoir pas à habiter le maintenant, le seul qui soit encore à nous.",
    "en": "So to devote oneself to transmission can soften the thought of vanishing, but at the cost of a detour: one busies oneself with the afterward so as not to have to inhabit the now, the only time still ours."
  },
  "deepenings": [
    {
      "id": "living-for-the-after",
      "label": { "fr": "Vivre pour l'après", "en": "Living for the afterward" },
      "targetStep": 2,
      "development": [
        {
          "fr": "Le souci de la postérité est ancien et noble, on plante des arbres dont on ne verra pas l'ombre, et nul ne le méprise. La question est seulement de savoir s'il doit commander toute une vie.",
          "en": "Care for posterity is ancient and noble, one plants trees whose shade one will not see, and no one scorns it. The only question is whether it should govern a whole life."
        },
        {
          "fr": "Car il peut servir d'alibi : on remet à l'héritage le soin de donner sens à des jours qu'on n'a pas su vivre soi-même, et la transmission devient alors ce qu'elle prétendait éviter, une façon de passer à côté de sa propre vie.",
          "en": "For it can serve as an alibi: one leaves it to the inheritance to give meaning to days one did not know how to live oneself, and transmission then becomes what it claimed to avoid, a way of passing one's own life by."
        }
      ]
    }
  ],
  "difficulty": 2,
  "responses": [
    {
      "id": "revise",
      "label": {
        "fr": "C'est juste : je ne verrai pas ce que je transmets, et je n'ai qu'une vie, la mienne, à vivre maintenant. C'est elle, d'abord, que je ne veux pas manquer.",
        "en": "That is right: I will not see what I transmit, and I have only one life, mine, to live now. It is that life, first, that I do not want to miss."
      },
      "hints": [{ "axisId": "TIME_ORIENTATION", "value": { "kind": "weights", "weights": [0.7, 0.15, 0.15] }, "weight": 2 }],
      "discussion": {
        "fr": "L'objection vous ramène au présent : avant de vivre pour l'après, vivre le seul temps dont vous soyez sûr, celui qui est là.",
        "en": "The objection brings you back to the present: before living for the afterward, to live the only time you are sure of, the one that is here."
      }
    },
    {
      "id": "qualify",
      "label": {
        "fr": "Je tiens à transmettre, mais sans m'oublier en chemin : prendre soin de ce qui me suit n'oblige pas à déserter ma propre vie.",
        "en": "I hold to transmitting, but without forgetting myself along the way: caring for what follows me does not require deserting my own life."
      },
      "hints": [{ "axisId": "TIME_ORIENTATION", "value": { "kind": "weights", "weights": [0.2, 0.1, 0.7] }, "weight": 1 }],
      "discussion": {
        "fr": "Vous gardez le souci de l'après sans lui sacrifier le présent : on peut transmettre et vivre, l'un n'exclut pas l'autre.",
        "en": "You keep the care for the afterward without sacrificing the present to it: one can transmit and live, the one does not exclude the other."
      }
    },
    {
      "id": "refute",
      "label": {
        "fr": "Vivre seulement pour soi et pour son temps, c'est la vraie petitesse. Qu'importe que je n'en voie pas le fruit : ce qui me dépasse vaut mieux que ce qui s'arrête à moi.",
        "en": "To live only for oneself and one's own time is the true smallness. What does it matter that I do not see the fruit: what exceeds me is worth more than what stops at me."
      },
      "hints": [{ "axisId": "TIME_ORIENTATION", "value": { "kind": "weights", "weights": [0, 0, 1] }, "weight": 0.5 }],
      "discussion": {
        "fr": "Vous assumez de vivre pour plus grand que vous : la valeur d'un legs ne se mesure pas à ce qu'on en retire, et c'est ce dépassement qui fait sa grandeur.",
        "en": "You accept living for something greater than yourself: the value of a legacy is not measured by what one gets from it, and it is that going-beyond that makes its greatness."
      }
    }
  ],
  "targets": ["memory-we-are-heirs"],
  "updatedAt": "2026-07-12T00:00:00.000Z"
}
